username,text,timestamp,has_images,number_of_images,replies,retweets,likes,has_video
Elon Musk,So many government agencies exist that even the government doesn’t know how many there are!,2024-10-21T14:59:13.000Z,False,0,3.2K,7.4K,28K,False
SAY CHEESE!,"Diddy accused of r*ping 7 more victims, including a 13-year-old girl who was drugged with 2 other celebrities at a VMA after party, in new lawsuits after 120 people came forward",2024-10-21T15:18:34.000Z,True,1,477,853,5.7K,False
Ash,Name a Keanu Reeves role that is not John Wick...,2024-10-20T22:05:19.000Z,True,1,1.3K,156,907,False
Savanah Hernandez,Pittsburgh- Antonio Brown is currently outside of the Steelers stadium wearing a dark MAGA hat and throwing out rally towels reading “Trump/Vance” ahead of tonight’s game,2024-10-20T20:32:47.000Z,True,1,253,5.4K,32K,True
Shadow of Ezra,"In Georgia, reports have surfaced that voting polls are being set up behind closed doors, with the public blocked from observing the process. 

A concerned resident confronted the sheriff, pointing out that Georgia law requires polls to be set up openly, allowing any citizen the",2024-10-21T12:24:46.000Z,True,1,265,2.3K,3.2K,True
HARDEST FIT PICS,"Lil Baby in Full Louis Vuitton, 2024",2024-10-21T02:06:26.000Z,True,1,1,54,1K,False
LeBron James,"Cleveland Fans! Yall know how much we’ve been thru throughout the years both good, bad and indifferent. With that being said booing anyone that’s down with an injury let alone your own player is LAME AF!!  To the ones who didn’t ",2024-10-21T03:46:25.000Z,False,0,3.1K,5.3K,37K,False
Laurence Tribe,"“To anyone paying attention, it is clear that Trump is not in any shape to manage the government of the United States of America. He is canceling interviews and botching the ones he does sit for, while falling asleep at events where he is not actually speaking. He lies",2024-10-21T10:39:58.000Z,False,0,393,3.5K,7.8K,False
MLFootball,"BREAKING: Davante Adams plans to request a trade from the #Jets before the #NFL trade deadline in two weeks from now.

Wow.",2024-10-21T03:27:57.000Z,True,1,648,1K,34K,False
Andrew McCarthy,"When Venus is at inferior conjunction, it can form a “ring” as the light scatters around it. I photographed this event in 2022, despite being only a few degrees away from the sun. This is something that can be dangerous to observe visually, so great care was taken when capturing.",2024-10-21T02:09:22.000Z,True,1,47,182,1.9K,False
PoliticsVideoChannel,BREAKING: Tesla Sales Plummet as Democrats Stop Buying the Electric Cars Due to Elon Musk,2024-10-21T07:07:30.000Z,True,1,363,1.2K,4.9K,False
Seth Abramson,"Elon Musk hates Trump and MAGA.

But Trump needs money and needs Elon, so he promised Elon he could shutter any federal department he wished.

And Elon *does* wish—to avoid jail and billions in fines.

From the NYT comes the story of what Elon, a con artist, *really* cares about:",2024-10-21T01:58:10.000Z,True,4,111,2.6K,5.4K,False
Bakarot,"Gogeta vs Broly!
(Remake)",2024-10-21T06:48:38.000Z,True,1,27,1.7K,18K,False
Covie,"Ok so what now??

Election lawyer says Elon Musk is breaking the law with latest stunt.",2024-10-20T21:04:58.000Z,False,0,1.2K,5.3K,14K,False
DC_Draino,"Isn’t it wild how a voting machine company is threatening the American people if we criticize them?

But it only has the opposite effect

We distrust these machines even more

We will scrutinize election fraud even harder",2024-10-20T21:32:42.000Z,False,0,629,9.1K,27K,False
ALX,"Pennsylvania Governor Josh Shapiro is threatening Elon Musk over giving $1M every day to registered swing state voters who sign the 
@America
 PAC petition in support of The Constitution.

“That is deeply concerning.. It's something that law enforcement could take a look at.""",2024-10-20T23:45:06.000Z,True,1,4.4K,2.3K,7.6K,True
Julia Terruso,AOC now responding to both Trump at McDonald’s and Musk’s $1 million giveaway. “Elon Musk thinks your vote can be bought”,2024-10-20T20:45:48.000Z,True,1,1.3K,3.9K,13K,True
Ryan Fournier,"BREAKING: The Supreme Court just rejected Michael Cohen’s efforts to sue President Trump.

Excellent.",2024-10-21T14:14:09.000Z,False,0,174,2.8K,24K,False
Autism Capital,"ELON MUSK: ""I hope I don't get shot. I was just on a German magazine saying I was 'enemy number two.' Enemy number two of what? I'm definitely upgrading my security. Maybe I should put an inflatable dummy of me in a motorcade. Just troll them."" ",2024-10-20T19:20:08.000Z,True,1,104,1.4K,9.8K,True
Wall Street Apes,"Seriously, how can ANYONE Vote Democrat?

Dr Phil “You're telling me that DHS has acknowledged that Venezuela, for example, is emptying their prisons and their rehabilitation centers with the understanding you get out if you leave here and go to the United States?”

Victor Avila,",2024-10-20T21:03:56.000Z,True,1,589,22K,41K,True
chart data,GloRilla's 'GLORIOUS' officially earns the biggest US first week sales for a female rap album in 2024.,2024-10-21T13:13:58.000Z,True,1,362,4.1K,23K,False
Bleacher Report," LIBERTY WIN THEIR FIRST CHAMPIONSHIP IN FRANCHISE HISTORY 

New York stand up ",2024-10-21T02:37:48.000Z,True,1,430,6.3K,29K,False
Garth Collins,"There are 36 mega churches in the state of Alabama, but it was an Native American casino that’s stepped up to pay for all of the tornado victims’ funerals.",2024-10-20T19:04:20.000Z,False,0,312,14K,110K,False
Star Wars,we found the droids we were looking for and more. #NYCC era unlocked.,2024-10-21T02:36:47.000Z,True,1,32,145,1K,True
Jack,"It's been about a decade of thick black unplucked caterpillar ""boy brows"" and hopefully the failure of this movie may put an end to it once and for all, since looking at both of their bushy eyebrows, greasy grown out zoomerish hair, and ratlike makeup-free faces is just one of",2024-10-21T04:23:24.000Z,True,1,55,86,817,False
Los Angeles Dodgers,"Unstoppable.

Tommy Edman is your NLCS MVP!",2024-10-21T03:45:08.000Z,True,1,372,4.6K,28K,False
Dutchsinse,"US Airforce used HAARP to make HAARP rings, and then used RADAR to look at them.

The glowing ""HAARP RINGS"" are plasma, and the plasma reflects the radar as if its solid, reflecting the RADAR back to the transmitter so they can see the rings on RADAR.

Here's the whole US",2024-10-21T01:19:32.000Z,True,1,13,247,633,False
Pop Base,Paul Mescal spotted at the Eras Tour.,2024-10-21T03:23:04.000Z,True,1,136,298,6.7K,False
The Hollywood Handle,"Matthew Lillard when asked if he’s in ‘SCREAM 7:’

“No, I'm not in the movie. And even if I was, I would lie direct to your face.”

(Via: 
@GameSpot
)",2024-10-21T04:51:55.000Z,True,1,143,953,24K,False
Angry Staffer,"I wonder if Trump realizes that he’s just the catalyst for the GOP establishment to get President Vance — the candidate they really want?

I wonder if MAGA gets it?",2024-10-21T12:05:34.000Z,False,0,1.3K,2.6K,10K,False
(((Harry Enten))),"A rather important development: Harris appears to be slightly outperforming Biden 2020 among Trump's base of non-college White voters.

This is key because they make up a ton of the electorate, especially in MI, PA & WI. Explains why she's holding her own in MI, PA & WI.",2024-10-21T13:45:16.000Z,True,1,438,1.4K,7K,True
Judd Legum,"1. If the government found someone laundered $67,000 in drug money, they would almost certainly go to jail

Meanwhile, TD Bank executives oversaw the laundering of $670 MILLION, but no one is going to jail

The company is paying a fine

Follow this thread for details",2024-10-21T12:50:39.000Z,False,0,73,1.5K,4.1K,False
Jonathan Turley,The Supreme Court just rejected Michael Cohen's last bid effort to revive his lawsuit against Trump for his incarceration as a politically manipulated case.  Cohen's effort to claim victimization is belied by his prior admission to criminal and unethical acts.,2024-10-21T13:52:24.000Z,False,0,99,1.1K,5.1K,False
Bleacher Report,"Russell Wilson in his Steelers debut 

16/29
264 YDS
2 TD

Went from being down 15-6 to winning 37-15 ",2024-10-21T03:39:57.000Z,True,1,455,1.8K,29K,False
DiscussingFilm,"The first trailer for ‘GOOSEBUMPS: THE VANISHING’ has been released.

Premiering January 10 on Disney+ and Hulu.",2024-10-20T18:37:18.000Z,True,1,280,2.1K,16K,True
DogeDesigner,This is the reason why the media machine calls Elon Musk the public enemy.,2024-10-21T01:05:10.000Z,True,1,438,1.1K,4.9K,False
Buzzing Pop,Ariana Grande looks gorgeous in Balmain in new photo.,2024-10-21T01:56:56.000Z,True,1,12,93,1.2K,False
Kevín,This script gone be done TONIGHT they start shooting TOMORROW.  In theaters FRIDAY!!,2024-10-20T19:35:16.000Z,True,1,219,5.3K,41K,False
Joe Pompliano,Shohei Ohtani. Aaron Judge. Mookie Betts. Juan Soto. Yoshinobu Yamamoto. Gerrit Cole. Los Angeles. New York.  Fox is going to make a billion dollars on this year’s World Series.,2024-10-21T03:29:44.000Z,False,0,126,2K,16K,False
Catherine Herridge,"This statement is an indicator 
@CBSNews
 hasn’t contained the fallout from its Kamala Harris 
@60Minutes
 edit.

Releasing the full unedited transcript is consistent with journalistic transparency and it stands behind the integrity of the entire Kamala Harris edit, not just the",2024-10-21T01:46:43.000Z,True,1,1K,9.3K,27K,False
Indianapolis Colts,"Welcome to the Ring of Honor, DC. ",2024-10-20T18:54:26.000Z,True,1,32,276,4K,False
LilKimUK,"New Footage: Missy Elliott, Kim Kardashian & Misa Hylton discuss Lil’ Kim’s iconic 1999 VMA’s outfit 

Taken from the new ‘In Vogue: The 90s’ documentary",2024-10-20T20:31:03.000Z,True,2,8,403,1.7K,True
ESPN,THE NEW YORK LIBERTY ARE BRINGING THE FIRST WNBA TITLE IN FRANCHISE HISTORY TO BROOKLYN ,2024-10-21T02:37:45.000Z,True,1,1K,6.4K,30K,False
Liz Churchill,"Nothing to see here other than Bill Gates, Dr. Fauci and Obama…predicting the next ‘Pandemic’ before ‘Covid’ re: Event 201.",2024-10-20T18:03:16.000Z,True,1,319,4.1K,6.7K,True
Jo,"That McDonalds was actually closed, so he was just pretending to work.
Just like he did when he was “president.”",2024-10-20T21:22:40.000Z,False,0,5K,10K,61K,False
John LeFevre,"On average, NBC shows Taylor Swift 7 times during an NFL broadcast. 

Tonight, they showed Trump only once, and just for a few seconds. 

This is why:",2024-10-21T02:10:31.000Z,True,1,786,9K,53K,True
George,"Something truly beautiful is happening in Pittsburgh, Pennsylvania right now. Former Steelers Legends Antonio Brown and Le’Veon Bell are registering hundreds of new Trump voters 

The culture is with Trump all the way this time.",2024-10-20T20:27:48.000Z,True,1,706,15K,69K,True
CALL TO ACTIVISM,"What the heck!?

Donald Trump suffers a serious 16 minute freeze at his Michigan rally, wandering from side to side on the stage. 

Trump’s cognitive decline is accelerating.",2024-10-20T22:56:21.000Z,True,1,2.6K,8.7K,29K,True
Julia Louis-Dreyfus,"I don't know about you, but I'd really like to get the government out of my f*cking snatch.",2024-10-20T20:16:28.000Z,True,1,12K,21K,95K,True
DiscussingFilm,"‘TRANSFORMERS ONE’ releases on Digital tomorrow, one month after the film’s theatrical release.

Read our review: http://bit.ly/TransformersDF",2024-10-21T15:08:40.000Z,True,1,180,560,5.4K,False
Pop Crave,‘Beautifully Broken’ by Jelly Roll debuts at #1 on the Billboard 200 with 161K units (114K pure sales).,2024-10-21T13:09:47.000Z,True,2,99,88,367,False
Nice Kicks,"Nike put a championship ring on the Statue of Liberty for the New York Liberty’s  WNBA Championship t-shirt  
@EldenMonitors",2024-10-21T02:40:34.000Z,True,1,7,125,356,False
Steve Cortes,"Grocery prices have soared to nightmare levels and placed devastating economic burdens on families.

In Kamala’s America, food inflation means kitchens have become places of anxiety and stress.

I went to Wisconsin to expose how bad it really is.

WATCH my new documentary Food",2024-10-21T12:16:44.000Z,True,1,76,470,1.1K,True
ELON DOCS,"Jonathan Turley: CEOs like Zuckerberg caved like a house of cards, but Musk couldn't be coerced or scared. They'll never forgive him for that.

“It's like another scene out of The Lord of the Flies. You have all these pundits and politicians chasing him around the island, and",2024-10-21T09:20:13.000Z,True,1,105,1.5K,5K,True
Nico Colaleo,"""That's All Folks"" from last night's LA premiere of the new Looney Tunes movie THE DAY THE EARTH BLEW UP. Gorgeous animation, hilarious, emotion and heart (!!), WEIRD (in a GOOD way!), with a packed, totally pumped audience. Avery, Clampett and Jones would be proud. Perfection!",2024-10-20T23:23:42.000Z,True,1,42,791,6K,True
Autism Capital,"ELON MUSK: ""We have an issue of apathy. Some people think their vote doesn't count and for whatever reason they have not registered to vote. Its important to get out there and explain the importance of this election and hows democracy is on the line. This is the most important",2024-10-20T19:35:41.000Z,True,1,205,817,3.1K,True
Complex Sneakers,"A monumental statement with a ring to match.
@Nike
 celebrates the 
@nyliberty
's first ring",2024-10-21T02:47:08.000Z,True,1,2,139,809,True
The Penguin,Friends close and enemies closer. #ThePenguin,2024-10-21T01:45:36.000Z,True,1,17,274,2.8K,True
Nike Basketball,A monumental statement with a ring to match.,2024-10-21T02:42:15.000Z,True,1,186,6.3K,19K,True
GloRilla,Gaddamn I luv ha,2024-10-21T04:11:01.000Z,True,1,274,2K,27K,True
Aaron Rupar,"Trump on Fox & Friends in response to a question about how he'll fix schools in the Bronx: ""No transgender, no operations. You know, they take your kid. There are some places, your boy leaves the school, comes back a girl. Without parental consent. What is that all about?""",2024-10-21T13:04:33.000Z,True,1,2.3K,3K,8.3K,True
Kylie Jane Kremer,"After watching 
@realDonaldTrump
 work at 
@McDonalds
, I had to have some! 

18 year old black male met me at the drive-thru window. I told him how Trump worked at McDonald’s today & I had to get some  

Him: “For real?”

Me: “Yes, in Pennsylvania!”

Him: “Inspiration! That’s why",2024-10-20T20:33:34.000Z,True,1,2.6K,6.2K,32K,False
Wall Street Apes,"Just when you think things can’t get any worse in Kamala Harris’ America

American Citizens being evicted from their homes in Springfield, Ohio so that illegal Haitian migrants can move in

Springfield City Commission Meeting Resident Speaking “I was approached yesterday by a",2024-10-20T22:55:28.000Z,True,1,1.2K,14K,27K,True
"Pam Keith, Esq.","I am learning while I knock doors that when people tell me they are voting for Trump because of the economy, they are really telling me they are voting for Trump because of white supremacy. 

I reach that conclusion because one follow up questions leaves them stumped:",2024-10-20T22:18:11.000Z,False,0,2.4K,7.6K,64K,False
Donald J. Trump,"Christians are under attack from this Administration, but many are still not registered! Tomorrow is the last day to register in Pennsylvania. Register now and vote early!!",2024-10-21T03:50:10.000Z,False,0,3.2K,18K,74K,False
Kamala Harris,"As president, it will be my priority to bring down prices. I will take on:

–Big corporations that illegally price gouge on food.
–Corporate landlords that unfairly raise rents on working families.
–Big Pharma, and cap the cost of prescription drugs for all Americans.",2024-10-21T02:08:00.000Z,False,0,5.1K,3.7K,13K,False
Jon Cooper,Who else was NOT surprised to learn that Trump’s event at a closed McDonald’s was totally staged and as fraudulent as he is? ,2024-10-20T21:32:34.000Z,True,1,9.7K,11K,45K,False
Aes,This Harris ad is fucking amazing.,2024-10-21T03:20:00.000Z,True,1,293,9.5K,22K,True
Gunther Eagleman™,"BOOM: JD Vance just called out the Democrats that say the McDonalds visit was staged:

“The fact that some are accusing President Trump of a ""staged"" event… OF COURSE he has to have security after two attempts on his life in two months.”

“He was talking to the employees, he was",2024-10-21T14:19:30.000Z,True,1,432,5.3K,23K,True
Le'Veon Bell,i’m taking the over tonight ,2024-10-20T23:17:04.000Z,True,1,1K,3.2K,43K,False
Catturd ™,"Be honest ...

How many of y'all are craving McDonald's fries right now?",2024-10-20T22:04:54.000Z,False,0,4.1K,2.5K,37K,False
Waka Flocka Flame,"GM IF YOU GM BACK 

Happy Monday SQUUAAAD  Make America Based Again ",2024-10-21T12:17:05.000Z,True,1,606,1.1K,9.8K,False
Clandestine,"Trump is working a shift at McDonalds right now, for no reason other than to troll Kamala for lying.

That’s it. 

Say what you want about him, but the man is objectively hilarious.",2024-10-20T19:18:42.000Z,True,1,1.4K,10K,91K,True
Bernie Sanders,"Yesterday Donald Trump did 15 minutes of work at McDonald’s, where tens of thousands of employees earn starvation wages.

But when asked whether we need to raise the $7.25 minimum wage, he refused to comment.

I will comment. We need to raise the federal minimum wage to $17/hr.",2024-10-21T15:23:27.000Z,False,0,1.3K,2.5K,11K,False
Science girl,"A 3D printed table that moves with its own legs 

 concept_bytes",2024-10-21T05:24:04.000Z,True,1,202,628,2.8K,True
TaraBull,"So, according to the Pennsylvania governor Josh Shapiro, Elon Musk can't give away money to US citizens, but the government can give away taxpayer money to iIIegals?",2024-10-21T04:03:45.000Z,True,1,532,6.7K,19K,False
Bill Madden,"By enthiastically supporting Kamala Harris over the loathsome piece of shit, Dave Bautista is one of the celebrities who has risen to the occasion. Here he is voting early in Tampa, Florida. ",2024-10-21T01:57:06.000Z,True,1,1.1K,5.9K,30K,True
MeidasTouch,"NEW: Trump is BOOED at the Steelers-Jets game in Pittsburgh. 

“BOOOOOO!!!!!! GET HIM OUTTA TOWN!!”",2024-10-21T02:30:34.000Z,True,1,1.6K,5.1K,23K,True
Rick Wilson,"Trump is showing slippage with <checks notes> non-college white voters. 

It's going swimmingly.",2024-10-21T14:25:54.000Z,False,0,382,1.5K,11K,False
Anonymous,It was all STAGED.  McDonald's intentionally closed for the day - there was even a 'rehearsal'.  This is a slap in the face to all of the hard-working people behind the scenes at fast food restaurants. Don the con.,2024-10-21T14:26:37.000Z,True,4,410,1.7K,6.1K,False
Dan Scavino Jr.,"10/20/24 | PITTSBURGH, PA…",2024-10-21T05:48:25.000Z,True,1,84,1.5K,6.9K,True
Jack Poso,"MAGA SUPPRESSION 

Hearing a lot of fake stories are being planned to drop to try to keep MAGA at home on Election Day

Be prepared - and Don’t Trust the Feds",2024-10-21T01:53:12.000Z,False,0,770,7.4K,22K,False
Kamala’s Wins,BREAKING: Pittsburgh Steelers legends Jerome Bettis and Mean Joe Greene just announced they are endorsing Kamala Harris. Let’s go.,2024-10-21T01:49:19.000Z,False,0,792,4.3K,26K,False
Doug Emhoff,"Being a girl dad is a gift. It’s also one of the reasons 
@BenStiller
 and 
@Andy
 are voting for 
@KamalaHarris
.",2024-10-21T14:12:09.000Z,True,1,465,1.7K,7.4K,True
DogeDesigner,"ELON MUSK: ""Dramatically increasing my risk of being assassinated and engaging in politics are not what I want to do. I do not have a death wish but the stakes are so high that I really feel I have no choice but to do it.""",2024-10-20T21:39:20.000Z,True,1,329,1.6K,6.6K,True
Tim Walz,".
@KamalaHarris
 and I both lost a parent to cancer.

It's the kind of loss that changes your life forever. There's the time before the cancer – and the time afterward. 

Grief is already painful enough. Families shouldn't have to suffer financially on top of it all. My mom had to",2024-10-21T12:36:09.000Z,True,2,1.2K,2.2K,11K,False
PoliticsGirl,"Trump didn’t “work a shift” or “serve customers”. He shut down a McDonald’s to cosplay as working class for his pathetic, pandering propaganda. #Sad",2024-10-21T05:01:52.000Z,False,0,2.1K,4.3K,21K,False
Catturd ™,"Florida is the 3rd most populated state in the USA and they'll have their votes counted and the results on election night. 

Any Secretary of State in any state who gets on TV today and says it'll take days to count the votes is a cheater, a traitor, and should be arrested.",2024-10-20T19:10:18.000Z,False,0,2.2K,26K,84K,False
muri,Lula molusco o maioral,2024-10-20T19:49:25.000Z,True,1,51,241,18K,False
Kamala Harris,Thank you to my friend Stevie—it’s a joy to spend my birthday in Georgia with all of you.,2024-10-20T19:16:21.000Z,True,1,3.8K,12K,73K,True
Autism Capital,"ELON MUSK: ""I was born in Africa, which is a strange spawn point, so I can't be President, but I don't want to be President, I want to build rockets and cars. I just love creating technologies that people find useful, so I'm hoping we get Trump elected and I can not be in",2024-10-20T19:45:31.000Z,True,1,604,4.1K,20K,True
David Frum,"Trump didn't ""work"" in a McDonald's. He posed.",2024-10-21T00:17:50.000Z,False,0,3.8K,2.2K,13K,False
Jo,"Back in 2016, Donald Trump said he would overturn Roe and that women would be punished.

Fast forward to 2024, where Roe has been overturned and women are in fact, being punished.

Take him seriously & literally.

When someone shows you who they are, believe them the first time.",2024-10-21T12:27:22.000Z,False,0,800,3.7K,10K,False
Aaron Rupar,"Q: Do you think it's possible to eliminate federal taxes?

TRUMP: There is a way. You know, in the old days, when we were a smart country, in the 1890s -- this is when the country was relatively the richest it ever was. It had all tariffs. It didn't have an income tax.",2024-10-21T13:23:04.000Z,True,1,964,950,2.6K,True
Azur Lane Official,"❀Full Moon's Feral Wolf❀

Awooo! Tonight is a full moon, so you'll want to be extra careful so I won't eat you up!

IJN Atago is changing into her new dynamic attire. She will grace your dock in the near future, Commander.

#AzurLane #Yostar",2024-10-21T02:00:01.000Z,True,1,154,1.4K,14K,False
Mark R. Levin,"Soros, gobbling up radio stations in collusion with the Democrat-controlled FCC.  Meanwhile, conservative billionaires do nothing.  A must read!",2024-10-21T12:37:32.000Z,False,0,91,485,985,False
Rick Wilson,"A vote for Jill Stein or for the late Robert F. Kennedy, Jr.  is a vote for Trump.",2024-10-21T14:07:57.000Z,False,0,256,1.6K,6.9K,False
The Daily Edge,"The enemy within.

Elon Musk, long subsidized by US taxpayers, is now using his unprecedented wealth to actively commit crimes in a slimy bid to overthrow democracy in his adopted home.",2024-10-21T03:44:35.000Z,False,0,158,1.7K,2.7K,False
Trump’s Lies (Commentary),"BREAKING: While Trump is in Pittsburgh tonight for the Steelers game, Steelers legends came out and endorsed Kamala Harris. This must be super embarrassing for Trump. Retweet so everyone knows about this.",2024-10-21T01:01:41.000Z,True,1,250,6.6K,13K,False
Republicans against Trump,"BREAKING

Moldova has voted YES to join the EU, despite a massive Russian interference campaign.",2024-10-21T12:32:58.000Z,True,1,153,1.8K,11K,False
Kamala Harris,"Join my conversation in Chester answering Pennsylvanians’ questions about my plans for the American people. Hosted by Congresswoman 
@Liz_Cheney
 and moderated by 
@SarahLongwell25
—watch now.",2024-10-21T15:36:42.000Z,False,0,2.4K,4.3K,21K,True
Aaron Rupar,Mark Cuban on CNBC: I sat in front of restaurant owners and asked them 'what would it be like if you got a knock on your door and there was someone from Stephen Miller's squad asking you for the immigration status of everyone who works for you?' That's not how you run a country.,2024-10-21T14:43:03.000Z,True,1,863,4.3K,14K,True
Dan Scavino Jr.,,2024-10-21T02:34:25.000Z,True,1,290,2.3K,13K,False
Ed Krassenstein,"MAGA wants Kamala Harris to provide proof of a job she held at McDonalds 41 years ago.

Why don't they ask Trump to provide proof that he helped clear rubble at the WTC after 9/11?

Oh that's right, because they don't actually care about truth. They care about setting bogus",2024-10-21T12:41:35.000Z,True,1,559,1.2K,4K,True
Republicans against Trump,"What is your plan to ban artificial foods?

Trump: “Bobby Kennedy, right? Everybody likes Bobby Kennedy. And he's so big into the healthy food and women things. Everything. He wants to do things.”

This isn't a word salad. This is verbal diarrhea",2024-10-21T14:12:38.000Z,True,1,715,2.6K,9.8K,True
Aaron Rupar,"Q: What is your plan to get artificial foods banned in our urban communities?

TRUMP: So, Bobby Kennedy, right? Everybody likes Bobby Kennedy. And he's so big into the health food and women things. Everything. He wants to do things.",2024-10-21T13:20:31.000Z,True,1,1.1K,1.5K,4.1K,True
Kamala HQ,Reporter: A brand new analysis finds that Social Security would run out in six years if Trump's agenda is enacted,2024-10-21T14:40:35.000Z,True,1,787,6.6K,13K,True
Kamala’s Wins,BREAKING: The McDonald’s location Trump “worked” at was cited earlier this year for health code violations. Disgusting.,2024-10-21T00:21:21.000Z,False,0,6K,3.2K,11K,False
Jack Poso,BREAKING: Pittsburgh is cheering so loud for Elon he can barely even talk!,2024-10-20T19:07:22.000Z,True,1,257,7K,39K,True
Kamala HQ,Gov. Walz: Donald Trump's handlers are saying he's exhausted. Well so are we. Americans are exhausted with his chaos,2024-10-21T15:28:54.000Z,True,1,421,1.9K,8.4K,True
Talkin' Yanks,Yankees and Dodgers will face off in the World Series for the 12th time,2024-10-21T03:19:59.000Z,True,1,234,2.4K,16K,False
Joe Scarborough,"Just a reminder to those trying to whitewash the Russia investigations as a hoax, the Republican-led Senate Intel Committee concluded that Trump’s campaign posed a “grave counterintelligence threat” that made the campaign susceptible to “malign Russian influence.”",2024-10-21T11:55:15.000Z,False,0,0,1.7K,3.1K,False
