username,text,timestamp,has_images,number_of_images,replies,retweets,likes,has_video
Kyle Brandt,Thoughts on the Steelers. Not the Jets.,2024-10-21T12:19:09.000Z,True,1,45,257,3.2K,True
Pop Crave,"Kendrick Lamar tells SZA that he is not an angry person:

“I don’t believe I’m an angry person. But I do believe in love and war, and I believe they both need to exist. And my awareness of that allows me to react to things but not identify with them as who I am. Just allowing",2024-10-21T13:37:39.000Z,True,1,88,76,972,False
goth ms frizzle,better look at last nights lightsaber eyeliner :),2024-10-20T20:25:06.000Z,True,1,41,17,1.6K,True
Republicans for Harris,"Elon Musk is promoting the content he wants promoted on here.

Don't be discouraged by algorithms. Millions of Republicans will cast ballots for Kamala Harris this November.

We've had enough of Donald Trump.",2024-10-21T01:37:38.000Z,False,0,12,332,1.3K,False
Leading Report,BREAKING: Steelers crowd erupts in a “USA” chant for former President Trump.,2024-10-21T01:19:56.000Z,True,1,201,1.6K,16K,True
Bo Loudon,"ELON MUSK JUST CALLED RIGHTFUL PRESIDENT TRUMP ""EPIC"" FOR WORKING AT MCDONALD'S TODAY!

""I think Trump actually is at McDonald’s…which is epic.""

Trump is a McLEGEND!

Kamala DEFINITELY wouldn't want you to share this!",2024-10-20T19:35:18.000Z,True,1,43,1.1K,3.3K,True
The Bitcoin Historian,"#Bitcoin price: $2.30 

Ever since, it's up 3,000,000% ",2024-10-21T11:05:36.000Z,True,1,99,363,1.5K,False
Candace Parker,"I’ve been to the finals. Won & lost ‘ships. But there is no bigger emotion than losing and listening to the other team celebrate while you are in the lockeroom. I can remember the champagne, but I can FEEL the gut wrenching pain in my stomach when we fell short…..",2024-10-21T02:57:45.000Z,False,0,60,564,8.9K,False
New York Liberty,"NYC, THIS IS FOR YOU!!!!

YOUR 2024 WNBA CHAMPIONS

WE ALL WE GOT, WE ALL WE NEED",2024-10-21T02:54:11.000Z,True,1,219,3.6K,12K,False
Digital Asset Investor,"Part 1
@elonmusk
 speaking on specific cryptos(Bitcoin and Dogecoin)
Part 2
""I certainly cannot speak to any specific crypto""(In regards to XRP)
@elonmusk",2024-10-21T10:36:01.000Z,True,1,26,83,356,True
SNY,"""Nobody else I'd do it with.""

An emotional Sean Manaea on the Mets' season:",2024-10-21T03:43:38.000Z,True,1,245,925,8.1K,True
AB,"Here We Go Steelers

On the Way  
@realDonaldTrump",2024-10-21T00:20:25.000Z,True,1,246,1.2K,12K,True
Spitfire,"They are now trying to imprison 
@elonmusk
 for offering money to sign a petition. 

A petition where you must already be a registered voter in a swing state to be eligible to win. You don’t have to be affiliated with any party and are not even required to vote.

Democrats don’t",2024-10-21T02:11:57.000Z,False,0,42,85,458,False
Pop Crave,‘BRAT’ by Charli xcx returns to its #3 peak on the Billboard 200 with 105K units (48K pure sales) — its biggest-ever week.,2024-10-21T13:10:41.000Z,True,2,172,259,4.8K,False
Arin Dube,"The greatest trick Elon Musk ever pulled was convincing the world he was more of an innovator than a rent-seeker.

He is a rent-seeker.",2024-10-21T03:49:59.000Z,False,0,61,173,1.1K,False
Mike McDaniel,"Donald Trump is 78. He did a podcast, a rally, a shift  at McDonalds and is now attending the #SNF game. Full
of energy.

I was on my couch all day, barely walked my dog and I’m exhausted 

#NYJvsPIT",2024-10-21T02:20:50.000Z,True,1,45,44,581,True
₿itcoinTeddy,"It’s over man, #Bitcoin is going to the moon.",2024-10-21T01:55:15.000Z,True,1,42,490,2.6K,True
ALEX,"Elon Musk: I'm hoping we get President Trump elected and I'll work hard on D.O.G.E., and then, after that, I hope I can not be in politics. That would be my hope.

I'm doing this because I think it's critical to the future of the country: if America falls nothing else matters.",2024-10-20T21:44:17.000Z,True,1,32,543,3.8K,True
Film Updates,Paul Mescal and Kirsten Dunst for Gucci,2024-10-21T13:11:14.000Z,True,1,36,239,2.9K,True
Mattibad,Smoke rings,2024-10-20T19:35:28.000Z,True,1,0,226,1.5K,False
John Cena,Perfection might be attainable but is never sustainable.,2024-10-21T10:15:03.000Z,False,0,964,1.8K,8.8K,False
John Pavlovitz,Elon Musk is a POS.,2024-10-21T01:19:48.000Z,False,0,67,121,1.5K,False
Alex Bruesewitz,,2024-10-21T04:42:30.000Z,True,1,283,3.8K,33K,False
GhettoGronk,"Kevin Stefanski: “I’m not benching Deshaun Watson”

God:",2024-10-20T19:10:56.000Z,True,1,185,5.5K,69K,True
WNBA,Went down for a sec but we good ,2024-10-21T04:40:39.000Z,True,1,244,1.3K,14K,True
DogeDesigner,These two Pennsylvania residents received $1 million each from Elon Musk for signing a petition in support of the First and Second Amendments! ,2024-10-20T23:35:39.000Z,True,1,747,1.6K,7.8K,False
The Walking Dead,Two episodes to go. #TWDCaryl,2024-10-21T02:00:01.000Z,True,1,91,50,809,False
good reddit,ㅤ,2024-10-20T19:35:00.000Z,True,1,685,10K,175K,False
DogeDesigner,"They ran hit pieces on Donald Trump, leading to two assassination attempts. Now, the same tactics are being used against Elon Musk.

For the sake of humanity, please vote them out.",2024-10-20T22:51:12.000Z,False,0,143,834,3.4K,False
Tim Murtaugh,"Quite a day in Pennsylvania.

Making fries and manning the drive-thru window at McDonald’s in Bucks County.

Holding a town hall in Lancaster with 
@sagesteele
.

Owning the Steelers game in Pittsburgh.

Pennsylvania is Trump country. The momentum is real and he’s winning.",2024-10-21T01:49:37.000Z,True,3,282,1.3K,5.4K,True
DogeDesigner,BREAKING: Democrats are in panic mode after seeing Elon Musk give away millions to American citizens who support the American Constitution.,2024-10-20T23:54:36.000Z,True,1,364,368,1.9K,True
Donald J. Trump,“TRUMP WILL END THE TAX ON SOCIAL SECURITY”,2024-10-21T13:11:41.000Z,True,1,3.1K,11K,53K,True
Hodgetwins,Man of the people,2024-10-20T20:09:14.000Z,True,1,2K,9.1K,126K,False
Ally Sammarco,"I’m so glad we have Mark Cuban, and not neurotic Elon Musk whose kids hate him",2024-10-20T17:49:24.000Z,False,0,98,526,6.1K,False
Autism Capital,Trump with World Liberty Fi token holders ,2024-10-20T22:53:58.000Z,True,1,81,126,2.9K,False
Alexandria Ocasio-Cortez,"LIBERTYYYY 
@nyliberty
 ",2024-10-21T02:39:21.000Z,False,0,262,606,8K,False
Bleacher Report,3  for Breanna Stewart,2024-10-21T02:41:49.000Z,True,1,212,951,12K,False
Emmett Shear,"I had the fortune to work have Andy Jassy as my boss at Twitch for a number of years. And he has many talents, but the one I was most awed by was how he delivered his judgement that progress was not fast enough yet without attacking on the team.",2024-10-20T19:29:54.000Z,False,0,13,35,1.2K,False
Western Lensman,"While Democrats and their media surrogates are still trying to recover from Trump manning the fryer at Mickey D’s

He’s already moved on to lead a USA chant in a packed NFL stadium

Unbelievable",2024-10-21T01:21:14.000Z,True,1,175,2.1K,12K,True
OBCrack,Rio goes EVERYWHERE Agatha goes —just to mess w her! #AgathaAllAlong,2024-10-20T21:07:29.000Z,True,1,20,331,3.1K,True
GhettoGronk,Deshaun Watson at his achilles rehab,2024-10-20T18:39:42.000Z,True,1,272,1.2K,28K,True
TaraBull,"Jelly Roll calls X 'Most Toxic' app ever, says he's leaving the platform",2024-10-21T10:00:02.000Z,True,1,4.3K,454,3.7K,False
Ron Filipkowski,"So Trump films a campaign commercial at a closed McDonalds with his supporters acting like “customers” after rehearsing going through the drive thru before he got there, and media is going to report that he “worked a shift” and “served customers?”",2024-10-20T21:24:04.000Z,False,0,1.7K,5.7K,19K,False
Tiffany Fong,just ate a bunch of pho & watched dune for the first time.,2024-10-21T02:42:38.000Z,True,1,292,27,1.3K,False
Spotrac,"Per a league source, $13.9M of Deshaun Watson's 2024 compensation has been insured by the #Browns, which should lead to a small salary cap credit for the team in 2025.

These insurance policies are becoming much more prevalent as NFL contracts continue to soar.",2024-10-21T13:04:59.000Z,False,0,7,74,367,False
Tommy Robinson,"Looks like I was right after all, I wished I wasn't.

A 61 year old grandfather was jailed for holding a placard, calling police 'corrupt', and for mentioning that asylum seekers are 'child killers' at a Holiday Inn Express in Manvers in August.

Peter Lynch took his own life",2024-10-21T11:42:36.000Z,False,0,970,4.6K,22K,False
IST ent,"[#더보이즈 뉴스] 더보이즈, 디스토피아 속 폭발적 비주얼…'트리거' 뮤비 티저

#THEBOYZ
@IST_THEBOYZ
https://naver.me/FHlIQqQs",2024-10-21T02:10:02.000Z,True,1,4,669,2.7K,False
Variety,"Another round of lawsuits have been filed against Sean “Diddy” Combs, including the allegation that he drugged and raped a 13-year-old girl with an unnamed “male celebrity” as an unnamed “female celebrity” watched.",2024-10-21T12:07:27.000Z,False,0,43,255,291,False
Sawyer Merritt,"Elon Musk today when asked if he would run for President: 

“There would have to be a constitutional amendment for me to run; but I don’t want to be President. I want to build rockets and cars.”",2024-10-20T19:39:52.000Z,True,1,581,1.4K,14K,False
DramaAlert,BEFORE VS AFTER MAKEUP IS INSANE! ,2024-10-21T00:24:56.000Z,True,2,138,54,548,True
4K Spider-Man Shots,4K shots of The Amazing Spider-Man (2012) ,2024-10-20T23:06:59.000Z,True,4,11,301,3.3K,False
Maile,"This article is fascinating. Of course we all knew there was a reason 
@elonmusk
 is throwing such vociferous support behind Trump. 

If Trump wins, Elon and his companies will essentially become unregulated and he will have an amount of power and American business man has never",2024-10-21T01:41:20.000Z,True,3,79,1.4K,2.1K,False
AB,"Davante Adams went from a 2-5 team to a 2-5 team (with the homies though)

#CTESPN",2024-10-21T04:21:06.000Z,False,0,244,2.4K,38K,False
TMZ,"Aaron Rodgers Appears To Pick Nose, Eat Boogers During 'SNF' Loss   |  Click to read more ",2024-10-21T13:55:18.000Z,False,0,117,93,335,False
RSBN,"LIVE: President Trump Delivers Remarks to the Press in Asheville, NC - 10/21/24",2024-10-21T14:02:03.000Z,False,0,1.4K,10K,42K,True
The Lincoln Project,15 days until the election.,2024-10-21T13:45:01.000Z,False,0,139,395,2K,False
DogeDesigner,"Elon Musk has provided more help to hurricane victims than the government itself and the media portrays him as a ""public enemy"".",2024-10-21T00:09:21.000Z,False,0,161,604,2.3K,False
TMZ,"Jelly Roll Calls X 'Most Toxic' App Ever, Says He's Quitting It   |  Click to read more ",2024-10-21T01:02:46.000Z,False,0,563,303,2.1K,False
ThePersistence,"Just received a phone call from a voter in Luzerne County.

He told me that 4/4 voters (meaning people that have voted 4 times in the last 4 years)

are finding that they are NOT registered to vote. 

I beg you to check your voter registration status right now.

Seriously, do it.",2024-10-21T14:52:10.000Z,False,0,333,8K,19K,False
ChicoEevee,"Pokémon UNITE Teraleak

Apparently they had planned to release the game with this mons at release

we can see Golduck, Froslass, Golisopod and Polteageist",2024-10-21T10:56:49.000Z,True,1,30,85,719,False
ESPN,OMG THE DODGERS ELIMINATE THE METS TO ADVANCE TO THE WORLD SERIES ,2024-10-21T03:24:36.000Z,True,1,1.6K,3.1K,18K,False
Remoulade Sauce,"Welcome to Scarf Sunday!

I am going to do my best to catalogue as many of our Late Queen’s Scarf Collection as possible and today, I bring you Queen Elizabeth at the Royal Windsor Horse Show on 08 May 2019

And she is wearing

Hermès silk twill La Promenade de Longchamps Scarf",2024-10-20T20:45:47.000Z,True,1,104,58,1.3K,False
Pop Base,"aespa on their new song ‘Whiplash’:

“Cats gon' copy one idea, two, then the whole look, then deny it.”",2024-10-21T11:54:57.000Z,True,1,591,11K,72K,False
Overwatch Anonymous,"Sailor moon x overwatch collab ideas 
Sailor moon: mercy 
Sailor mercury: mei 
Sailor mars: symmetra  
Sailor jupiter: zarya 
Sailor venus: illari 
Tuxedo mask: genji",2024-10-20T22:30:00.000Z,False,0,159,275,3.9K,False
Pop Crave,"“…Ready For It?” by Taylor Swift has reached 800 MILLION streams on Spotify.

It’s her 26th song to achieve this.",2024-10-21T08:17:52.000Z,True,2,140,136,1.6K,False
Access Bad Bunny,Bad Bunny’s “nadie sabe lo que va a pasar mañana” has won “Album Of The Year” at the 2024 Latin Billboard Music Awards. ,2024-10-21T03:21:00.000Z,True,2,17,344,3K,False
TaraBull,This is disappointing,2024-10-21T10:30:01.000Z,True,1,2K,368,4.8K,False
CBS News,"Birth control, condoms and the “morning after” pill would be fully covered by private health insurance without a prescription under a rule proposed by the White House on Monday.",2024-10-21T12:15:00.000Z,False,0,179,1.3K,4.2K,False
The Penguin,The end of an era. #ThePenguin,2024-10-21T01:03:20.000Z,True,2,30,291,5.1K,False
NFL,"well that escalated quickly, 
@steelers
 ",2024-10-21T03:44:23.000Z,True,1,236,2.9K,42K,False
Complex Sneakers,Puma celebrates Stewie's first ring ,2024-10-21T02:41:49.000Z,True,1,18,70,579,False
New York Post,"In Logansport, Indiana, kids are being pushed out of schools after migrants swelled county’s population by 30%: ‘Everybody else is falling behind’ https://trib.al/3F2nAOA",2024-10-21T10:02:54.000Z,True,1,175,981,1.7K,False
Olivia of Troye,"Just tried to post about an incredible #RepublicansForHarris effort today in Lancaster, Pennsylvania. This platform keeps saying there’s a problem. So I’m posting without the media story link to tell you that there’s an amazing coalition working together in Lancaster that’s going",2024-10-21T01:05:57.000Z,False,0,348,4.5K,15K,False
NBACentral,"Real Madrid is showing interest in Lonnie Walker, per 
@BasketNews_com",2024-10-21T14:00:02.000Z,True,1,390,942,21K,False
Los Angeles Dodgers,"#DodgersWin!

FINAL: #Dodgers 10, Mets 5",2024-10-21T03:24:38.000Z,True,1,603,7.7K,20K,True
Jack Poso,ELON: We must stop teaching girls and women that if you get pregnant your life is over. Having a child is an act of bravery,2024-10-20T19:44:33.000Z,False,0,1.3K,5.4K,36K,False
Brick Suit,"PRESIDENT TRUMP McDONALDS MEME DUMP!
Post your favorites!",2024-10-21T12:20:27.000Z,True,1,1.1K,4.5K,46K,False
Barbra Streisand,Elon Musk is paying people to sign a petition that is thinly disguised support of Donald Trump. He also offered 1 million dollars to a petition signer. Campaign finance laws should prevent this type of quasi bribery.,2024-10-21T13:35:51.000Z,False,0,512,1.1K,3.7K,False
Caт Вee ✡︎,The Hermès Birkin Handbag is real. The oppression is a knockoff.,2024-10-20T21:35:18.000Z,True,1,218,1.2K,6.2K,False
Jon Cooper,"Holy shit! My conservative Republican neighbor, who I’ve mentioned a few times over the past months, is voting for Kamala Harris! He says he changed his mind after watching her Fox News interview. I know it’s just one vote, but if you knew this man you’d be just as shocked as me!",2024-10-21T14:07:32.000Z,False,0,1.3K,3.1K,16K,False
Polymarket,"Trump's odds continue to rise.

He's now 24% ahead with 15 days to go.",2024-10-21T14:25:51.000Z,True,1,364,1.8K,11K,False
NFL Memes,"*Aaron Rodgers throws absolute dime*

Garrett Wilson:",2024-10-21T02:28:52.000Z,True,1,91,866,13K,True
𝙗𝙡𝙖𝙣𝙠,Nike Triax Watches (2000s),2024-10-20T20:26:45.000Z,True,1,5,116,1.5K,False
America,"ELON MUSK: “We need to reduce the size of the government, spend less money, and let the people keep a lot more of their hard earned money.”",2024-10-20T20:44:45.000Z,True,1,1.3K,5.1K,28K,True
Bleacher Report,"Deshaun Watson has a torn Achilles and will miss the rest of the season, per 
@RapSheet",2024-10-21T15:02:02.000Z,True,1,277,429,2.3K,False
cinesthetic.,Emilia Clarke for Marie Claire,2024-10-21T04:10:00.000Z,True,2,91,251,8.5K,False
CINEMA 505,Louis Garrel em Saint Laurent.,2024-10-20T18:29:00.000Z,True,4,16,486,5.9K,False
Jack Poso,"How many times did they show Taylor Swift when she went to Chiefs, and now they won’t show Trump at the Steelers game",2024-10-21T01:43:14.000Z,False,0,1K,3.6K,27K,False
Buzzing Pop,"Bach Buquen, who went viral for challenging makeup norms among men, reveals he’s half-Vietnamese and half French-Italian.",2024-10-21T15:21:26.000Z,True,2,493,521,6.6K,False
Cenk Uygur,"Some in the press called Trump's McDonald's photo-op bizarre. This is how you lose credibility. That was a home run photo-op. He looked like a real person there, connecting with the average American. If you can't see that, you're totally blind.",2024-10-21T13:44:29.000Z,False,0,2.6K,3.6K,40K,False
AB,"CTE

Certified 

Trump 

Endorser 

#CTESPN",2024-10-20T22:45:46.000Z,False,0,214,1.5K,28K,False
Concerned Citizen,The ‘Great Noticing’ Continues,2024-10-20T19:58:25.000Z,True,1,478,11K,53K,True
ThePersistence,"There are going to be a lot of unhappy Pennsylvania voters

that will check their status AFTER tomorrow’s deadline 

only to find out that they are NOT registered to vote. 

It takes literally 1 minute to check your voter registration status.",2024-10-20T18:23:09.000Z,False,0,420,8.1K,21K,False
popculture,"britney spears records herself doing skin care, 2002",2024-10-21T12:55:27.000Z,True,1,10,143,1.3K,True
Trixie Mattel™,"a young girl. KIMBERLY lipstick from 
@TrixieCosmetics",2024-10-20T22:24:24.000Z,True,1,12,47,2.3K,False
Paul Rudnick,"The ""I hate Trump but I'm voting for him because of the economy"" is total bull. He left office with the worst economy in 40 years. You're voting for him because you think his bigotry is a superpower that will protect you",2024-10-21T00:51:18.000Z,False,0,1.5K,7.5K,47K,False
Vivek Ramaswamy,"Here’s what we need: single day voting on Election Day, as a national holiday, with paper ballots & government-issued ID. But we have to WIN to get there. Don’t be shy about voting early this time. Gotta win by the rules we have now, to ever change them to what they should be.",2024-10-20T23:19:16.000Z,False,0,1.2K,7K,39K,False
The Babylon Bee,Trump Promises To Bring Back The Good Happy Meal Toys https://buff.ly/40dWxnq,2024-10-20T19:38:48.000Z,True,1,539,4.8K,36K,False
Wrestle Ops,Donald Trump will be on The Undertaker’s ‘Six Feet Under’ podcast tomorrow.,2024-10-21T02:31:00.000Z,True,1,352,1.1K,11K,True
Cole Cubelic,"We do it each week, MY Sunday SEC takeaways...

ALABAMA: So much of it didn't go together. QB runs looked to be there. He does not seem to be getting north/south with same authority. His feet were a mess. Very few throws looked to be completely set. RBs played hard. Would like to",2024-10-21T04:33:43.000Z,False,0,28,65,783,False
Seth Abramson,"() I wonder if people realize the national crisis Elon Musk has now created. If Pennsylvania is the decisive state in November and Trump wins it by a small amount, Musk will have left a *literal paper trail* of the felony he committed to steal the election.

What do we do then?",2024-10-20T20:02:58.000Z,True,1,2.1K,8.4K,25K,False
Insurrection Barbie,"The people who are telling you that Donald Trump is going to go after his political opponents are currently doing the Sunday shows and saying that Elon Musk needs to go to prison.

If you give these people one more inch, they will ACTUALLY do every single thing they are accusing",2024-10-21T00:20:36.000Z,False,0,132,3.1K,7.8K,False
Roger Stone,"WTF?!

DOD Authorizes Lethal Force By US Military Against US Citizens",2024-10-21T14:19:25.000Z,True,2,341,1.9K,3.8K,False
Dom Lucre | Breaker of Narratives,DEVELOPING: Tim Walz created a ‘game plan’ on how he will beat Donald Trump with Kamala Harris.,2024-10-21T02:02:18.000Z,True,1,2.2K,688,3K,True
Hodgetwins,How long til Kamala works a Popeyes drive thru?,2024-10-21T10:47:35.000Z,False,0,798,488,6.4K,False
The Babylon Bee,Trump Forced To Cancel Campaign Rallies For Next Two Weeks As Time Off Request Denied By McDonald’s Manager https://buff.ly/3YwOxwk,2024-10-21T00:37:05.000Z,True,1,807,9.9K,73K,False
Richard Grenell,"My Uber driver in Grand Rapids said he drove one of the VIPs for Kamala Harris this past weekend. 

He saw “more than 10 buses” of people who knocked on doors and were bussed to her rally. 

They weren’t from Michigan, he says.",2024-10-21T13:16:53.000Z,False,0,121,1.5K,4.1K,False
Philip Anderson,BREAKING: McDonald’s just went on the record today and officially put out a statement saying that Kamala Harris NEVER worked at McDonald’s. This means that Kamala Harris lied about her resume on top of lying about her heritage and her grandmothers identity.,2024-10-21T01:06:07.000Z,False,0,2K,14K,78K,False
Glenn Kirschner,"Hey men, with a vote for Harris you can support and protect the health and safety of your wife, your daughters, your nieces, your granddaughters, your female friends & acquaintances. Or, with a vote for Trump, you can deprive them all of their autonomy and endanger their lives.",2024-10-21T12:48:09.000Z,False,0,759,3.5K,8K,False
The Walking Dead,Daryl was always trying to get home. #TWDCaryl,2024-10-21T02:18:15.000Z,True,1,28,118,589,True
Bleacher Report,"One of the best WNBA Finals we've ever seen.

Thank you to the Liberty and Lynx for an amazing series ",2024-10-21T02:47:28.000Z,True,1,336,906,9.2K,False
AB,"I mentioned it a couple weeks ago

They didn’t show Elon Musk

They didn’t want to show Donald Trump

They for sure not showing me

We need unbiased non agenda Media ",2024-10-21T04:21:12.000Z,False,0,308,1.5K,16K,False
Jeff Flake,"I’m voting for Kamala Harris not in spite of being a conservative, but because I’m a conservative. Conservatives believe in the rule of law. 

https://video.twimg.com/amplify_video/1848118717894242304/pl/h_tcZ8uS68mbzbN6.m3u8?tag=16…",2024-10-20T23:01:57.000Z,False,0,12K,9.8K,41K,False
Truthseeker,Footage of a Satanic P Diddy party allegedly part of a documentary produced by 50 Cent has Surfaced,2024-10-21T06:19:16.000Z,True,1,13,226,621,True
Kyle Griffin,"The Biden admin is proposing a new rule that would provide women with private insurance access to over-the-counter birth control pills and other contraceptives at no cos.

The rule expands a federal mandate requiring health insurers to cover preventative care services at no cost",2024-10-21T14:15:17.000Z,False,0,33,461,1.6K,False
Dutchsinse,"Bit of an issue-- a swarm of noteworthy earthquakes M5.8+ has started at the ""S"" shaped plate boundary where Indonesia branches Northwards to Philippines, Eastward to Papua New Guinea, and Westward towards Java/Sumatra.

Important to keep watch on something like this for nearterm",2024-10-21T06:58:36.000Z,True,1,26,192,762,False
Juanita Broaddrick,"Holy Sht!!   This clip from  O’Keefe’s 
“A Line In The Sand” is unbelievable!! 

Undercover pretending to be asylum seeker walks into NY Roosevelt Hotel and is offered free room and taxpayer funded flight anywhere— with no ID. 

KAMALA’S  AMERICA!!",2024-10-20T18:05:37.000Z,True,1,546,22K,45K,True
Alina Habba,"Michael Cohen has exhausted every avenue of his pathetic attempt to drag my client into court time and time again.  As expected, the Supreme Court has correctly denied Michael Cohen's petition and he must finally abandon his frivolous and desperate claims.",2024-10-21T13:57:51.000Z,False,0,404,1.9K,9.6K,False
George Takei,"Overheard:  So does GOP stand for “Genital Obsessed Party” now? What with the anti-trans ads, bathroom police, and now Arnold Palmer’s wing-wang?",2024-10-20T23:44:35.000Z,False,0,718,3.4K,13K,False
Michael Beschloss,Republican President Gerald Ford's daughter Susan has now endorsed Kamala Harris.,2024-10-21T14:48:35.000Z,False,0,462,1.7K,7.4K,False
Political Polls,"#New General election poll - Swing State's 

Georgia -  Harris +4
Michigan -  Harris +2
Pennsylvania -  Harris +2
Wisconsin -  Harris +3
Nevada -  Tie
N. Carolina -  Trump +3
Arizona -  Trump +3

Schar ",2024-10-21T12:11:16.000Z,False,0,385,682,5.8K,False
Inga,If Archie Bunker debated Tim Walz. ,2024-10-21T13:02:07.000Z,True,1,377,6.4K,14K,True
PatriotTakes,A woman gave Trump double middle fingers at the Steelers game. MAGA hasn’t noticed and is posting it everywhere.,2024-10-21T02:42:56.000Z,True,1,792,2K,10K,True
Eduardo Menoni,| Jaime Bayly dice que NO votará por Donald Trump y que votará por la comunista Kamala Harris que odia a Elon Musk y a Erik Prince.  Yo pienso que Jaime Bayly es tremendo pendejo que perdió el norte y que es un socialista de closet ¿y tu?,2024-10-21T02:46:21.000Z,True,1,1.3K,1K,4.7K,True
Bleacher Report,"THE WORLD SERIES MATCHUP IS SET 

WHO YOU GOT?! ",2024-10-21T03:44:57.000Z,True,1,1K,2.3K,23K,False
Harper’s BAZAAR,"Kendrick Lamar is starting to create distance between who he is as a person and who he is as an artist. “I can’t hold my true whole identity to that person who’s on stage,” he tells 
@sza
 for our November Issue. “It’s too much to deal with.”",2024-10-21T13:20:43.000Z,True,1,13,108,712,False
Western Lensman,"NEW: Mark Cuban says he tried to arrange a meeting with Kamala staffers and 
@elonmusk
 — 

But the staffers ""didn't trust the fact that [Elon] wouldn't go on X and just say something to distort the purpose of the meeting.""

Cuban was asked if a victorious Kamala admin would",2024-10-21T13:30:53.000Z,True,1,331,202,1.1K,True
Anthony Scaramucci,Door knocking in PA yesterday. Stay on this to victory. We will be back at it next week. ,2024-10-21T12:02:04.000Z,True,1,230,1.3K,7K,True
Pop Crave,Jelly Roll scores his first #1 album on the Billboard 200 with ‘Beautifully Broken.’,2024-10-21T13:09:51.000Z,True,1,470,428,1.9K,False
John Collins,I think about this all the time.,2024-10-21T13:13:49.000Z,True,1,1.3K,840,6.4K,False
Johnny Midnight,Maybe he should? ,2024-10-21T01:07:29.000Z,True,1,290,6.4K,27K,False
