username,text,timestamp,has_images,number_of_images,replies,retweets,likes,has_video
Popular Liberal,"UH-OH! A massive new update! Rumors suggest Elon Musk's involvement is backfiring on the Trump campaign. True Christian conservative voters are fed up with the gaslighting and propaganda. 

Concerns grow about Musk's close ties to foreign dictators and his undisclosed role in the",2024-10-21T02:17:05.000Z,True,1,1K,4.6K,9.7K,False
Jon Cooper,The irony is that Trump’s 34 felony convictions would prevent him from getting a job at McDonald’s.,2024-10-20T19:45:32.000Z,True,1,3.2K,20K,177K,False
Libs of TikTok,This is gonna go down in history as the photo that won Trump the election,2024-10-20T19:13:52.000Z,True,1,5.5K,29K,230K,False
Nick Sortor," NOW: President Trump has just landed in Asheville, NC to meet with victims and see the devastation caused by Hurricane Helene

These folks have been essentially ABANDONED by the Biden Harris regime

But Trump won’t let them be forgotten!",2024-10-21T15:25:12.000Z,True,1,413,3.5K,13K,True
Shawn Farash,"BREAKING: 

TRUMP WINS MCDONALD'S EMPLOYEE OF THE YEAR!",2024-10-21T13:56:37.000Z,True,1,326,2.2K,7.8K,True
𝓒𝓸𝓷𝓼𝓮𝓻𝓿𝓪𝓽𝓲𝓿𝓮𝓓𝓲𝓿𝓪™,"This pretty and soft spoken Trump supporter had a compelling dream and feels led to share it.

Regardless of what you think of this type of message, whether you believe it came from the Lord or not, what she has to say certainly rings true to me.

I tell you one thing that you",2024-10-20T21:37:10.000Z,True,1,133,1.3K,3.2K,True
ONE PIECE スタッフ【公式】/ Official,"【解禁】

来週11.1(金)発売！
コミックス110巻のカバーを初公開

巨兵海賊団の助けにより
未来島脱出に光が見えた一味だったが…！？

一方、Dr.ベガパンクの放送が始まり
世界は震撼する──

収録話数は1111〜1121話の全11話！
お見逃しなく！",2024-10-21T03:00:02.000Z,True,1,0,4.1K,24K,False
The Penguin,Speaking of cooked... #ThePenguin,2024-10-21T02:30:00.000Z,True,1,50,484,5.6K,True
Taylor Swift Updates,Taylor chose 2 friendship bracelets from the little girl who got the 22 hat!,2024-10-21T00:41:41.000Z,True,1,32,213,6.3K,True
The Vigilant Fox,"Longtime Democrat Bill Ackman Fires Off a Dire Warning to America

He says the Democratic Party's policies are so destructive that they're indistinguishable from what our worst enemies would do to ""destroy America from within.""

Ackman then dropped the receipts with 33 damning",2024-10-20T23:50:36.000Z,True,1,856,18K,40K,True
Sawyer Merritt,"Journalist: ""I don't want to get into an autonomous Tesla in the next 5 years. I'm not going to be an early adopter.""

Uber CEO: ""FSD is getting pretty good. Have you used it recently? It's really good; Elon has accomplished the unimaginable many times. I wouldn't bet against",2024-10-21T01:01:09.000Z,True,1,179,278,3.4K,True
Shawn Harris for Congress,"BREAKING: Georgia's GOP Secretary of State publicly debunked my opponent Marjorie Taylor Greene's claims of Dominion machines switching ballots of people voting for her to my name.

Please retweet so everyone knows that MTG is petrified of losing and is spreading misinformation.",2024-10-21T01:54:14.000Z,True,1,270,10K,18K,True
New York Liberty,GOOD MORNING FROM YA 2024 WNBA CHAMPIONS ,2024-10-21T13:43:38.000Z,True,4,66,865,4.2K,False
Autism Capital,"ELON MUSK: ""It's pretty wild that a tiny tax on tea started the revolution and now we get the living daylights taxed out of us and theres no revolution. You get taxed on what you earned, you get taxed on what you buy, and you get taxed on what you own. Taxes, taxes, taxes, and",2024-10-20T20:25:37.000Z,True,1,1.1K,13K,54K,True
Rénaldo ,"I still wonder why we didn't get a Super Saiyan Bardock in Sparking Zero

HE IS AWESOME",2024-10-20T20:17:55.000Z,True,1,160,565,11K,True
Ron Filipkowski,So the place wasn’t even open. It was all staged and fake. He didn’t work for real at a McDonalds. It was a staged fraud just like every other event.,2024-10-20T19:35:28.000Z,True,1,26K,36K,125K,False
Seth Abramson,"Perhaps no stunt in the history of U.S. politics deserves more ridicule than the grotesquely embarrassing mummery Trump put on at a Pennsylvania McDonald’s today

The whole country got sh*ttier because of this

The McDonald’s was closed, the customers were fake, Trump did nothing",2024-10-21T01:24:48.000Z,True,1,5.1K,8.3K,25K,False
カモミール Chamomile,温泉が恋しいね,2024-10-21T09:05:27.000Z,True,1,84,782,18K,False
Donald J. Trump,Christians must register to VOTE now. This is the last day to do so. Our Country is at stake! God Bless You All! DONALD J. TRUMP,2024-10-21T14:01:57.000Z,False,0,3K,11K,48K,False
Dom Lucre | Breaker of Narratives,DEVELOPING: This Democrat woman has pledged to film herself eating dog food until Kamala Harris is elected for president,2024-10-21T14:50:18.000Z,True,1,2.9K,1.6K,4.8K,True
Dave Rubin,"BREAKING: Kamala Harris to do Five Guys today.

Unclear if she will also visit a burger joint.",2024-10-21T13:32:08.000Z,False,0,2.6K,5K,45K,False
Kamala Harris,"In 15 days, we have the power to chart a new way forward—one that is worthy of the country that we are blessed to call home.",2024-10-21T12:10:08.000Z,True,1,5.4K,4K,18K,False
Donald J. Trump,"Gun owners must register to Vote, TODAY, if you want to save your guns. Our Second Amendment is under Siege by the Democrats. They want to confiscate your guns. BE SMART. VOTE!!!",2024-10-21T14:02:38.000Z,False,0,2.4K,8.9K,32K,False
Tim Walz,"Before I was governor, I was a high school teacher and football coach.

Trust me. You take the time to draw up a playbook like Project 2025, you’re gonna use it.",2024-10-21T00:28:38.000Z,True,1,8.5K,7.1K,28K,True
Insurrection Barbie,An interview with the gentleman who got kicked out of the Kamala Harris rally for saying Christ is King.,2024-10-20T18:23:04.000Z,True,1,500,11K,26K,True
Jack Poso,BREAKING: Josh Shapiro threatens to have Elon Musk arrested for handing out money to town hall attendees who sign his America petition,2024-10-20T23:41:37.000Z,True,1,3.4K,3.1K,10K,True
Pittsburgh Steelers,us rn,2024-10-21T02:48:59.000Z,True,1,83,2.2K,13K,True
Lara Logan,One of the greatest crimes ever carried out against the American people.,2024-10-20T23:57:28.000Z,True,1,1.1K,15K,43K,False
Juanita Broaddrick,"McDonalds gave Trump time off to attend The game.  lol. 

Crowd shouting U. S. A. , U. S. A. !!",2024-10-21T01:03:19.000Z,True,1,704,7.1K,47K,True
il Donaldo Trumpo,I EVEN FIXED THE ICE CREAM MACHINE!!!,2024-10-20T18:56:35.000Z,True,1,1K,9.9K,76K,False
Charlie Kirk,"Dear Kamala, instead of denigrating Christians, THIS is how you respond when someone in the crowd praises Jesus:

CROWD: ""Jesus is King.""

JD VANCE: ""That's right. Jesus is King!""",2024-10-20T22:28:32.000Z,True,1,1.4K,12K,64K,True
Catturd ™,You can tell Tump's McDonald's event was extremely effective by the nuclear meltdown by the Left.,2024-10-21T12:23:42.000Z,False,0,910,2.9K,27K,False
Billy Baldwin,"You're voting for a man who in the final days of the campaign said:

Harvey Weinstein got ""schlonged""

Arnold Palmer had a huge shvantz.

Stopped a town hall meeting to shuffle for 40 minutes to a musical interlude.

That he would use the military to punish his political rivals.",2024-10-20T19:38:57.000Z,False,0,177,2.5K,7.7K,False
HustleBitch," #BREAKING:  Federal Class-action LAWSUIT filed against Joseph Biden - Kamala Harris - Pfizer - Moderna

 This is MASSIVE. 

The lawsuit demands an end to:

 Covid-19 vaccines

 Chemtrails",2024-10-21T01:00:18.000Z,True,3,577,10K,23K,False
Shawn Farash,"The Left isn't mad that Trump worked at McDonald's today.

They're mad that he looked normal doing it. They're mad that it was a fun and lighthearted occasion. And they're mad that their candidate isn't capable of doing something like that.

Kamala couldn't even buy Doritos like",2024-10-21T02:41:44.000Z,False,0,1.3K,5.3K,32K,False
Dan Scavino Jr.,“Ohhh—you’re very stingy with thisproduct…” ,2024-10-21T12:21:09.000Z,True,1,252,1.6K,8.8K,True
Sebastian Gorka DrG,"Can we hear it for the McDonalds franchise owner in Festerville-Trevose, PA who said yes to having President 
@realDonaldTrump
 visit?",2024-10-21T00:25:22.000Z,True,1,292,4K,32K,True
Collin Rugg,"NEW: Donald Trump’s odds to win the election jump 2 points on political betting platform Polymarket after he picked up a shift at McDonalds.

Genius.

Trump now leads Harris by 24% and is also surging in every swing state on Polymarket. Here is where he stands:

Arizona:

Trump:",2024-10-21T14:49:49.000Z,True,1,327,879,6.8K,True
BrooklynDad_Defiant!,"Somebody please explain to me why it's illegal to give an elderly person standing on line in the sun to vote a bottle of water, but a fucking billionaire can give away a million dollars a day to BRIBE swing state voters, no problem?

That seems illegal AF.",2024-10-21T13:52:52.000Z,False,0,676,3.8K,12K,False
Libs of TikTok,"""You made it possible for ordinary people like us to meet you"" 

Trump: ""You're not ordinary. You are not ordinary."" 

Trump is the people’s President!",2024-10-20T19:30:22.000Z,True,1,1K,10K,76K,True
Kamala’s Wins,"BREAKING: CNN just reported that Donald Trump is losing steam with his biggest base. White, non-college voters are abandoning Trump. This is huge.",2024-10-21T13:08:18.000Z,True,1,2.3K,5.2K,22K,True
DC_Draino,"Michigan says they won’t have vote totals on election night

Pennsylvania says they won’t have vote totals on election night

Georgia says they won’t have vote totals on election night

Arizona says they won’t have vote totals on election night

How do 3rd world countries hand",2024-10-20T17:50:45.000Z,False,0,7.5K,37K,108K,False
Geraldo Rivera,"Do the right thing for yourself and your country
She is a warrior and a peacemaker, and I am proud heartily to endorse Kamala Harris for President, but it may not be without complications. When my initial endorsement went viral, a photographer taking my picture for a magazine",2024-10-21T01:48:09.000Z,False,0,6.7K,4.3K,18K,False
Charlie Kirk,"Here's just a partial list of some of Kamala's most extreme policies and positions:

- She's says an unconstitutional, multi-TRILLION dollar reparations scheme is ""something that needs to be studied.""

- She's calling for $20 billion dollar in forgivable loans for only black",2024-10-20T23:56:37.000Z,False,0,242,2.5K,6.3K,False
JD Vance,President Trump showed how to connect with voters in Pennsylvania yesterday better than anyone else could - from the french fry station at McDonald's to the Steelers game on Sunday night.,2024-10-21T15:15:37.000Z,True,1,1.4K,3K,19K,True
Gunther Eagleman™,The GOAT wheels down in Asheville NC!  Where’s Kamala?,2024-10-21T15:23:10.000Z,True,1,171,744,3.2K,True
Kamala HQ,"UAW President Shawn Fain: Donald Trump, a 78-year-old who’s spent his life screwing over workers, was putting on a show today playing dress-up at McDonald’s to act like he’s one of us. Kamala Harris doesn’t have to put on a show. She actually wore the uniform",2024-10-21T00:52:46.000Z,True,1,1.8K,8.8K,31K,True
Laura Loomer,"WATCH: President Trump says he will be going back to North Carolina tomorrow “Just to let the people know I’m with them.”

While 
@KamalaHarris
 has abandoned the people of North Carolina after Hurricane Helene, Donald Trump will always be with the people.",2024-10-20T21:29:12.000Z,True,1,416,10K,39K,True
Trump War Room,".
@JDVance
: ""What we find weird about this is that Kamala Harris has been able to produce no evidence that she worked at McDonalds and she didn't even talk about it until 2019 -- The media will try to nitpick and micromanage every single thing that me or Donald Trump has said and",2024-10-21T13:18:31.000Z,True,1,228,1.7K,8.3K,True
Eric Daugherty," BREAKING: PENNSYLVANIA GOP LANDSLIDE in the last week of voter registration.

 Republican: +27,673 
 Democratic: +12,722

That's OVER 2-TO-1 for the GOP. And a new record. HOLY SHLIT.
@UPTGOP",2024-10-21T13:46:53.000Z,False,0,224,1.4K,9.3K,False
DogeDesigner,"""Tesla is a big company and it makes great cars. Elon Musk never once said could you ease up the electric thing. He never asked for any favor.""

一 Donald Trump",2024-10-21T07:42:49.000Z,True,1,452,1.2K,7.2K,True
“CLASSY” FRED BLASSIE,when in pilsen i must wear the largest pair of hoop earrings i own,2024-10-21T01:03:55.000Z,True,1,29,5,496,False
BrooklynDad_Defiant!,"Good morning and Happy Monday to everyone who was disgusted by trump's STAGED stunt at a closed McDonald's with fake customers. He STIFFS workers every chance he gets, and refuses to pay overtime.

MAGA may be dumb, but America ain't buying his bullshit.",2024-10-21T12:30:00.000Z,True,1,602,1.5K,4.4K,False
Dom Lucre | Breaker of Narratives,"DEVELOPING: Kamala Harris In laws uploaded this bizarre video wishing her a happy birthday. There is something wrong with this, I just don’t know what.",2024-10-20T23:31:41.000Z,True,1,3.1K,1.4K,5.7K,True
Kamala Harris,"If you are not sure who to vote for, I invite you to watch Donald Trump’s rallies.

He talks a lot about himself, fictional characters, and other nonsense. What he doesn’t talk about is you, and how to make your life better.",2024-10-21T01:36:20.000Z,True,1,4.1K,3.6K,11K,True
End Wokeness,"Soros buys 220 radio stations before the election, gets fast-tracked by the FCC

Media: This is fine

Elon Musk gets voters to sign a petition

Media: JAIL HIM",2024-10-21T00:09:19.000Z,False,0,680,7.5K,33K,False
Ian Sams," New AP poll has Harris’ favorability **22 points** higher than Trump’s

Harris +5 (50-45%) vs. Trump -17 (40-57%)

Also, asked who to trust:

Harris +12 on middle class taxes
Harris +5 on housing costs
Harris +2 on jobs/employment
Harris +24 on abortion",2024-10-21T12:32:29.000Z,False,0,724,1.6K,5.9K,False
Ron Filipkowski,"No, they say filming yourself pretending to work at a McDonald’s when it has been closed for hours then preparing food while committing 2 health code violations which the restaurant has been cited for in the past to serve to supporters who rehearsed ahead of time is bizarre.",2024-10-21T02:46:27.000Z,True,1,1.6K,5.8K,24K,False
Brian Krassenstein,"WOW! The Central Park 5 have just sued Trump for his remarks below at the September 10th debate where he stated they had pleaded guilty to a crime.

""Plaintiffs demand judgment against Defendant Donald J. Trump for compensatory damages, for punitive damages and for costs, in an",2024-10-21T14:22:16.000Z,True,1,331,1.4K,4.6K,True
The Lincoln Project,"Kamala Harris is building a future where every little girl in America can grow up with confidence, ambition, and a good role model. Trump doesn’t care for America’s young girls, and probably isn’t allowed within 50 ft of them.",2024-10-21T10:00:57.000Z,True,1,271,2.3K,5.4K,True
CALL TO ACTIVISM,"AOC just now (about Trump putting on a McDonalds costume and Elon’s million dollar contest):

“They’re not empathizing with us, they’re making fun of us.” ",2024-10-21T00:59:01.000Z,True,1,603,6.1K,18K,True
Republicans against Trump,"Fmr. GOP Sen. Jeff Flake:

“I’m voting for Kamala Harris not in spite of being a Republican or a conservative, but because I’m a conservative. Conservatives first and foremost believe in the rule of law. And to have a former president who lost a free and fair election then",2024-10-20T21:47:09.000Z,True,1,1.2K,10K,35K,True
Juanita Broaddrick,Kamala could never sit down and speak off the cuff like this.  She does not have the mental capacity,2024-10-21T13:39:50.000Z,True,1,88,1.1K,5.3K,True
Hodgetwins,Kamala’s lie about working at McDonalds backfired BAD,2024-10-21T12:13:33.000Z,False,0,206,798,9K,False
Catturd ™,McDonald’s just got millions of dollars of free advertisement.,2024-10-20T19:44:08.000Z,False,0,1.3K,4.5K,48K,False
Jo,"Just now on NPR:
‘Over the weekend, Donald Trump held a campaign rally in which he talked about the anatomy of a deceased golfer, threatened to use our military to arrest his political rivals and said police officers should be allowed to use violent force as a deterrent.
Next up",2024-10-21T11:26:15.000Z,False,0,322,1.7K,6.4K,False
Benny Johnson,Is this a man who seems tired? ,2024-10-21T01:38:55.000Z,True,1,415,1.3K,15K,False
Dan Scavino Jr.,"Happening now—President Trump arrives at Acrisure Stadium in Pittsburgh, Pennsylvania for the Steelers vs. Jets game…",2024-10-21T01:09:02.000Z,True,1,360,3.5K,16K,True
Benny Johnson,"MAGA hats spotted all over the stadium at the Steelers game tonight 

Were so back ",2024-10-21T01:34:24.000Z,True,1,289,2K,19K,True
The Lincoln Project,"Cosplaying as a fast food worker while you're trying to cut overtime pay for workers w/ Project 2025 is a different type of evil.

Page 592 of Project 2025 promises to remove overtime pay for employees in order to increase profits for employers.",2024-10-20T18:23:41.000Z,True,2,2.3K,11K,22K,False
Kamala Harris,Donald Trump should never again stand behind the seal of the President of the United States.,2024-10-20T22:11:15.000Z,True,1,6.3K,5K,24K,True
Laura Loomer,"President Trump posted this on Tik Tok today. 

It’s currently the most viral video on TikTok today.",2024-10-20T21:03:44.000Z,True,1,677,6.4K,35K,True
Kamala HQ,"Trump claims Black unemployment has “just skyrocketed”

FACT CHECK: This is a total lie. Black unemployment is at near historic lows right now.",2024-10-20T21:56:10.000Z,True,1,1.3K,7.9K,25K,True
Bill Clinton,"I gathered some friends in Raleigh to wish you a happy birthday, 
@KamalaHarris
! You're talented, you're gutsy, and you've spent a lifetime fighting for what's right. 

The best thing anyone can do to celebrate your birthday is make a plan to vote: http://IWillVote.com",2024-10-20T21:50:08.000Z,True,1,0,6.5K,33K,True
Dan Scavino Jr.,President Trump: “I’ll never forget this experience…”,2024-10-20T18:53:37.000Z,True,1,1.1K,9.4K,57K,True
Megyn Kelly,"Everything. Everything about Trump has to be negative - evil, weird, disturbing and so on. The media can’t allow for even a moment of levity - he must be demonized no matter how charming or funny or self-deprecating he ever manages to be. They’re sick.",2024-10-20T22:06:45.000Z,True,1,4.4K,7.2K,39K,False
Newsweek,"An inspection report for the McDonald's restaurant in Pennsylvania cited employees not having ""hands clean and properly washed.""

https://newsweek.com/mcdonalds-donald-trump-worked-failed-last-health-inspection-1971998…",2024-10-21T12:31:31.000Z,True,1,2.7K,1K,1.3K,False
Wu Tang is for the Children,"Trump got two degenerates Le'Veon Bell and Antonio Brown….Kamala Harris has an actual Pittsburgh Sleelers legend, The Bus!",2024-10-20T23:55:01.000Z,True,1,253,2.9K,17K,True
七沢みあ,大好き黒ネイルとバイバイしてくる,2024-10-20T22:22:52.000Z,True,1,174,523,12K,False
President Biden,"Congressional Republicans prefer to work with special interests to give tax breaks to the wealthy and big corporations.

Kamala and I prefer to lower costs for working families by building more homes, making child care more affordable, and capping costs on prescriptions drugs.",2024-10-21T14:15:01.000Z,False,0,779,1K,3.7K,False
Tristan Tate,"Working in fast food is not humiliating.

I’ve done it.

It’s good honest work. Shout out to everybody holding it down behind the counter.

This is what democrats think of you.",2024-10-21T12:32:53.000Z,True,1,416,1.1K,14K,False
Jim Acosta,‘Central Park Five’ members sue Trump for defamation after his debate comments on 1989 case,2024-10-21T14:44:30.000Z,False,0,201,918,4.6K,False
MeidasTouch,THIS CROWD ,2024-10-21T14:09:15.000Z,True,1,50,617,2.4K,True
Bill Kristol,The Biden economy is so strong businesses are willing to hire convicted felons out on bail.,2024-10-20T18:55:37.000Z,True,1,6.3K,26K,162K,False
Pop Crave,Cher and Dua Lipa sing “Believe” together at the Rock & Roll Hall of Fame ceremony.,2024-10-20T19:29:37.000Z,True,1,104,360,3.4K,True
LANEIGE THAILAND,Experience truly smart skincare with a 2-in-1 toner. Get all of the moisture in a milky light texture! Discover the JIN-IUS of Cream Skin with BTS Jin.,2024-10-21T01:30:00.000Z,True,1,109,4.3K,10K,False
#Venom: The Last Dance,"Bigger and better.  Get tickets for #Venom: The Last Dance, exclusively in theatres this Thursday. https://venom.movie",2024-10-21T03:16:54.000Z,True,1,13,104,558,True
Art Candee,"Oh snap!!!!

The Central Park 5 just sued Donald Trump for defamation, false light, and intentional infliction of emotional distress.

Donald Trump has falsely defamed these men for over two decades and continues to do so to this day.",2024-10-21T14:16:04.000Z,True,1,261,2.3K,6.6K,False
Benny Johnson,"TRUMP: ""I've now worked for 15 minutes more than Kamala"" at McDonald's 

Absolute legend.",2024-10-20T18:20:58.000Z,True,1,2.8K,22K,191K,True
Kamala HQ,"Coach Walz explains how Trump’s Project 2025 will affect you.

This is their playbook, and they plan to use it:",2024-10-21T14:07:33.000Z,True,1,455,1.8K,5.3K,True
Autism Capital,"ELON MUSK: ""The left just doesn't seem to like that people on the right can say what they want to say, within the bounds of the law. The constitution really is under attack.

One prominent democrat after another has been saying that freedom of speech is a bad thing.

John",2024-10-20T21:28:34.000Z,True,1,184,1.2K,4.6K,True
Kamala HQ,"Q: Trump keeps calling Americans who don’t support him ‘the enemy within.’ Why is that necessary?

Vance: Well, Trump is speaking from the heart",2024-10-21T13:37:20.000Z,True,1,997,1.5K,4.5K,True
MeidasTouch,"TONIGHT: Steelers honor a Navy SEAL during the game. Chants of 'USA' ERUPT!

MAGA is trying to claim these 'USA' chants were for Trump. That’s just more stolen valor from MAGA.

We are hearing the Steelers did not show Trump even once on the Jumbotron.",2024-10-21T02:43:36.000Z,True,1,1K,4.7K,23K,True
@amuse,"MCDONALD’S: McDonald’s stated it has no record of Kamala Harris ever working for the company but they made it clear she is welcome to work at one of its restaurants as Trump did earlier today. 

h/t 
@McFranchisee",2024-10-21T00:34:27.000Z,True,1,1.3K,7.8K,24K,False
MeidasTouch,This ENTIRE Florida community has signs in support of Harris-Walz,2024-10-21T13:39:39.000Z,True,1,112,1.1K,4.8K,True
Watch What Happens Live!,Martha Stewart speaks on Ina Garten's new memoir and Snoop gets filled in on it,2024-10-21T01:13:00.000Z,True,1,10,49,505,True
Art Candee,Mark Cuban says that Elon Musk may be violating gaming laws with his $1 million payout to people who sign his petition in Pennsylvania. ,2024-10-20T21:55:46.000Z,True,1,111,1.3K,3.5K,False
Q," MAJOR ALERT: WHAT IS ELON MUSK SAYING ???

MARK MY WORDS ...
THIS WAS NEVER ABOUT AN ELECTION.",2024-10-21T00:37:21.000Z,True,1,93,587,2.5K,True
DogeDesigner,"ELON MUSK: ""I hate politics. I don't want to be in politics. I'm a technologist. I build rockets and cars. I derive joy from seeing people enjoy the products that my companies make. 

But the stakes are so high that I had no choice but to take a stand.""",2024-10-20T20:15:43.000Z,True,1,516,2.3K,9.6K,True
Gays For Trump,"Governor of my home state, Josh Shapiro of Pennsylvania, is actually threatening to have Elon Musk ARRESTED simply for giving away $1,000,000 to random people who sign a petition to support the Constitution.

The Democrats are the real threat to Democracy!",2024-10-21T00:00:47.000Z,True,1,279,459,1.6K,True
Jack Poso,"It’s wild. Elon is just traveling PA, hanging out with the people of the state, taking question after question from them. Richest man in the world is showing so much respect to PA",2024-10-20T21:46:18.000Z,True,1,209,5.9K,32K,True
Catturd ™,Trump's McDonald's event today really triggered the Left - ,2024-10-20T21:31:38.000Z,False,0,1.5K,3.4K,44K,False
Pigeons & Planes,From Q-Tip's speech after A Tribe Called Quest were inducted into the Rock and Roll Hall of Fame,2024-10-20T21:13:27.000Z,True,1,2,98,547,True
Amanda Cerny,Sundays ,2024-10-20T21:11:57.000Z,True,1,809,1.2K,57K,False
Brooks |,Star Wars Theory if YouTube didn’t allow rage bait,2024-10-21T12:12:03.000Z,True,1,40,97,1.5K,True
Victor Shi,"BOOM. Mark Cuban tells Latino men in Arizona, “I’m here to tell you how you can make more money under Kamala Harris than you would under Donald Trump.” No message gets better than this one & there is no better messenger of this perfect message than Mark Cuban. So good.",2024-10-20T22:52:31.000Z,True,1,2.3K,10K,41K,True
Harper’s BAZAAR,"For our November cover story, no topic was off limits for 
@kendricklamar
 and 
@sza
. “I feel my work in music is just the start,” Lamar says. “I don’t think it’s my end goal. I know it’s not my end goal. Music is just a vessel to get me there.”",2024-10-21T12:50:06.000Z,True,1,5,116,680,False
Empire State Building,"THE 
@NYLIBERTY
 ARE WORLD CHAMPIONS. 

LIGHT THE BUILDING",2024-10-21T02:39:39.000Z,True,1,110,3.7K,18K,False
Nick Piccone,"Eagles @ Giants: ""I might have a tough time sleeping if Saquon goes to Philly, I'll tell you that"" Edition

As heard on New York Giants radio",2024-10-20T21:13:43.000Z,True,1,11,115,1.9K,True
Joe Merrick,"Today is 25 years since I began the site that became Serebii.

It's so surreal that this has gone on for a quarter of a century. The site has grown constantly. The last few years have been the busiest and most used it ever has been. It's wild.

#Serebii25

Thread/",2024-10-21T12:01:11.000Z,True,1,371,1.5K,14K,False
NCT DREAM CENTER,"NCT DREAM #MARK will be attending a Polo Ralph Lauren Event ""Timeless Style : Ralph's New York"" in Seoul, South Korea

 241025, 5pm KST
#NCTDREAM 
@NCTsmtown_DREAM",2024-10-21T10:30:40.000Z,True,2,2,1.7K,4.7K,False
Detroit Lions,I love this freakin' team,2024-10-21T01:53:21.000Z,True,1,270,3.3K,21K,True
